{
  "receipt_id": "receipt_evt_20260528_083536109Z_ops-0052_backlog_rook_delivered_9e40b8fa9796299b",
  "schema_version": "rook-hermes-receipt.v1",
  "event_id": "evt_20260528_083536109Z_ops-0052_backlog",
  "event_type": "task_state.changed",
  "correlation_id": "corr_ops-0052_20260528_083536109Z",
  "idempotency_key": "task_state.changed:ops-0052:intake:backlog:2026-05-28T08:35:35.934Z",
  "source_system": "dashboard",
  "target_system": "rook",
  "acknowledged_by": "rook",
  "state": "delivered",
  "acknowledged_at": "2026-05-28T08:35:58.753Z",
  "event_file": "/root/.openclaw/workspace/operations/events/archive/2026/05/evt_20260528_083536109Z_ops-0052_backlog.json",
  "event_digest_sha256": "9e40b8fa9796299b7fa8cce71214d0c357a82a44eb9bde225428826750c73334",
  "classification": "ops-internal",
  "notes": "Dispatcher delivered evt_20260528_083536109Z_ops-0052_backlog from outbox to rook."
}
